{
  "contract_id": "open-duck-mini.best-walk.101x14.v1",
  "inputs": {
    "acceleration_m_s2": [
      1.35,
      0.1,
      11.0
    ],
    "action": [
      0.004555541090667248,
      0.2085677832365036,
      -0.4156337082386017,
      -0.02815249003469944,
      0.533426821231842,
      0.5295259952545166,
      -0.1344377100467682,
      -0.3773936927318573,
      -0.12272878736257553,
      0.10750705748796463,
      -0.17967981100082397,
      0.47244787216186523,
      0.3113659918308258,
      0.38151881098747253
    ],
    "action_history": [
      [
        -0.052840881049633026,
        0.29866716265678406,
        -0.3405977189540863,
        0.058015983551740646,
        0.5650681853294373,
        0.6368481516838074,
        -0.07400460541248322,
        -0.23295114934444427,
        -0.1517396867275238,
        0.03881331533193588,
        -0.20326955616474152,
        0.6589031219482422,
        0.31551602482795715,
        -0.034884776920080185
      ],
      [
        0.0,
        0.0,
        0.0,
        0.0,
        0.0,
        0.0,
        0.0,
        0.0,
        0.0,
        0.0,
        0.0,
        0.0,
        0.0,
        0.0
      ],
      [
        0.0,
        0.0,
        0.0,
        0.0,
        0.0,
        0.0,
        0.0,
        0.0,
        0.0,
        0.0,
        0.0,
        0.0,
        0.0,
        0.0
      ]
    ],
    "commands": [
      0.08,
      0.0,
      0.0,
      0.0,
      0.0,
      0.0,
      0.0
    ],
    "foot_contacts": [
      0.0,
      0.0
    ],
    "gyro_rad_s": [
      0.0,
      0.0,
      0.0
    ],
    "phase": [
      0.9730448705798238,
      0.23061587074244014
    ],
    "positions_rad": [
      0.002,
      0.057,
      -0.629,
      1.363,
      -0.785,
      -0.003,
      -0.003,
      0.002,
      -0.002,
      -0.003,
      -0.071,
      0.633,
      1.376,
      -0.796
    ],
    "previous_motor_target_rad": [
      -0.011210220262408256,
      0.127666790664196,
      -0.7151494297385216,
      1.3825039958879353,
      -0.6792,
      0.1048,
      -0.018501151353120804,
      -0.05823778733611107,
      -0.03793492168188095,
      0.006703328832983971,
      -0.11581738904118538,
      0.7398,
      1.4578790062069893,
      -0.8047211942300201
    ],
    "previous_rate_target_rad": [
      -0.011210220262408256,
      0.127666790664196,
      -0.7151494297385216,
      1.3825039958879353,
      -0.6792,
      0.1048,
      -0.018501151353120804,
      -0.05823778733611107,
      -0.03793492168188095,
      0.006703328832983971,
      -0.11581738904118538,
      0.7398,
      1.4578790062069893,
      -0.8047211942300201
    ],
    "soft_offsets_rad": [
      0.0844,
      0.0721,
      -0.089,
      0.0371,
      -0.0767,
      0.0245,
      0.0,
      -0.089,
      -0.0399,
      0.0951,
      -0.0476,
      0.066,
      0.0798,
      0.1887
    ],
    "velocities_rad_s": [
      0.0,
      0.0,
      0.0,
      0.0,
      0.0,
      0.0,
      0.0,
      0.0,
      0.0,
      0.0,
      0.0,
      0.0,
      0.0,
      0.0
    ]
  },
  "legacy_outputs": {
    "observation": [
      0.0,
      0.0,
      0.0,
      1.35,
      0.1,
      11.0,
      0.08,
      0.0,
      0.0,
      0.0,
      0.0,
      0.0,
      0.0,
      0.0,
      0.0040000000000000036,
      0.0010000000000000009,
      -0.0050000000000001155,
      -0.0010000000000000009,
      -0.003,
      -0.003,
      0.002,
      -0.002,
      0.0,
      -0.0059999999999999915,
      -0.0020000000000000018,
      -0.0030000000000001137,
      0.0,
      0.0,
      0.0,
      0.0,
      0.0,
      0.0,
      0.0,
      0.0,
      0.0,
      0.0,
      0.0,
      0.0,
      0.0,
      0.0,
      0.0,
      -0.052840881049633026,
      0.29866716265678406,
      -0.3405977189540863,
      0.058015983551740646,
      0.5650681853294373,
      0.6368481516838074,
      -0.07400460541248322,
      -0.23295114934444427,
      -0.1517396867275238,
      0.03881331533193588,
      -0.20326955616474152,
      0.6589031219482422,
      0.31551602482795715,
      -0.034884776920080185,
      0.0,
      0.0,
      0.0,
      0.0,
      0.0,
      0.0,
      0.0,
      0.0,
      0.0,
      0.0,
      0.0,
      0.0,
      0.0,
      0.0,
      0.0,
      0.0,
      0.0,
      0.0,
      0.0,
      0.0,
      0.0,
      0.0,
      0.0,
      0.0,
      0.0,
      0.0,
      0.0,
      0.0,
      -0.011210220262408256,
      0.127666790664196,
      -0.7151494297385216,
      1.3825039958879353,
      -0.6792,
      0.1048,
      -0.018501151353120804,
      -0.05823778733611107,
      -0.03793492168188095,
      0.006703328832983971,
      -0.11581738904118538,
      0.7398,
      1.4578790062069893,
      -0.8047211942300201,
      0.0,
      0.0,
      0.9730448705798238,
      0.23061587074244014
    ],
    "physical_target_rad": [
      0.08753888527266682,
      0.1772419458091259,
      -0.8229084270596504,
      1.3980618774913252,
      -0.7273432946920395,
      0.15688149881362914,
      -0.03360942751169205,
      -0.18334842318296432,
      -0.07058219684064387,
      0.11897676437199116,
      -0.157519952750206,
      0.8191119680404664,
      1.5366414979577065,
      -0.5119202972531319
    ],
    "sent_target_rad": [
      0.003138885272666812,
      0.10514194580912589,
      -0.7339084270596504,
      1.3609618774913252,
      -0.6506432946920395,
      0.13238149881362915,
      -0.03360942751169205,
      -0.09434842318296432,
      -0.030682196840643883,
      0.02387676437199116,
      -0.109919952750206,
      0.7531119680404663,
      1.4568414979577065,
      -0.7006202972531319
    ]
  },
  "phase_evidence": {
    "current_post_advance_phase": [
      0.8936326403234123,
      0.4487991802004621
    ],
    "deployed_order_confirmed": true,
    "observation_phase": [
      0.9730448705798238,
      0.23061587074244014
    ],
    "previous_post_advance_phase": [
      0.9730448705798238,
      0.23061587074244014
    ]
  },
  "schema_version": "open_duck_x5.contract_snapshot.v1",
  "source": "/home/sunrise/duck_logs/20260627T221019Z_corrected_dynamic_replay/suspended_policy_replay_x008_corrected_knee.jsonl:ticks:0,1"
}
